### ISSUE TITLE
No packet sent in 0.2.4

### ISSUE THREAD

**Issue by pysiak** [okTurtles/dnschain#27]
Client looks up A record for c.bit using dig. dnschain listening on port 5333.

```
$ dig c.bit a @178.216.201.222 -p 5333

; <<>> DiG 9.8.4-rpz2+rl005.12-P1 <<>> c.bit a @178.216.201.222 -p 5333
;; global options: +cmd
;; connection timed out; no servers could be reached
```

As 178.216.201.222 is the local host, tcpdump listening on lo. It shows only packets sent by dig, no responses:

```
root@dc1:~# tcpdump -n -i lo port 5333
tcpdump: verbose output suppressed, use -v or -vv for full protocol decode
listening on lo, link-type EN10MB (Ethernet), capture size 65535 bytes
23:00:47.943322 IP 178.216.201.222.34716 > 178.216.201.222.5333: UDP, length 23
23:00:52.943447 IP 178.216.201.222.34716 > 178.216.201.222.5333: UDP, length 23
23:00:57.943562 IP 178.216.201.222.34716 > 178.216.201.222.5333: UDP, length 23
```

dnschain logs in debug mode:

```
2014-07-10T20:58:48.869Z - debug: [DNS] received question
{ name: 'c.bit',
  type: 1,
  class: 1 }
2014-07-10T20:58:48.870Z - debug: [DNS] resolving via nmc...
{ fn: 'cb|.bit',
  nmcDomain: 'd/c',
  q:
   { name: 'c.bit',
     type: 1,
     class: 1 } }
2014-07-10T20:58:48.871Z - debug: [NMC]
{ fn: 'resolve', path: 'd/c' }
2014-07-10T20:58:48.879Z - debug: [DNS] nmc resolved query
{ fn: 'nmc_show|cb',
  q:
   { name: 'c.bit',
     type: 1,
     class: 1 },
  d: 'd/c',
  result:
   { name: 'd/c',
     value: '{"info":{"registrar":"http://bitcoins.me"},"email": "web@dmin.guru"}',
     txid: '98fae121d4c9f0ee90e151842bf007d33c432280dea8174f446b2ed4bc065fa1',
     address: 'Mxo94oEiyePyv5ffGE3fAtaQA9QvKmL7H3',
     expires_in: 28984 } }
```

3 times as dig attempts thrice.

Worked with 0.2.3. Doesn't with 0.2.4

My ~/.dnschain/dnschain.conf is:

```
[log]
level=debug

[dns]
port=5333
oldDNSMethod=NO_OLD_DNS
oldDNS.address=127.0.0.1
oldDNS.port=53

[http]
port=8088
tlsPort=4443
```

Any ideas?
