### ISSUE TITLE
dnschain retries despite getting NXDOMAIN

### ISSUE THREAD

**Issue by pysiak** [okTurtles/dnschain#9]
got.bit has the value `{"ns":["qwert"]}`
obviously it's a globally non-resolvable NS for which an oldDNS will return NXDOMAIN (regardless if it's google or my dnsmasq)

When you ask dnschain for A on got.bit:
`$ dig a got.bit @127.0.0.1 -p 5333`
You will see that dnschain retries the same query:

```
2014-04-25T08:24:40.380Z - info: [DNS] {"ns":["qwert"]}
2014-04-25T08:24:45.380Z - info: [DNS] {"ns":["qwert"]}
2014-04-25T08:24:50.381Z - info: [DNS] {"ns":["qwert"]}
```

despite getting NXDOMAIN each time:

```
root@dev1:~# tcpdump -n -i lo port 53
tcpdump: verbose output suppressed, use -v or -vv for full protocol decode
listening on lo, link-type EN10MB (Ethernet), capture size 65535 bytes
10:25:46.192655 IP 127.0.0.1.48479 > 127.0.0.1.53: 45319+ A? qwert. (23)
10:25:46.192806 IP 127.0.0.1.53 > 127.0.0.1.48479: 45319 NXDomain 0/0/0 (23)
10:25:51.195273 IP 127.0.0.1.48479 > 127.0.0.1.53: 38789+ A? qwert. (23)
10:25:51.195381 IP 127.0.0.1.53 > 127.0.0.1.48479: 38789 NXDomain 0/0/0 (23)
10:25:56.194094 IP 127.0.0.1.48479 > 127.0.0.1.53: 6786+ A? qwert. (23)
10:25:56.194200 IP 127.0.0.1.53 > 127.0.0.1.48479: 6786 NXDomain 0/0/0 (23)
```

I think it should pass the NXDOMAIN back to the client at first time.
